{
  "schemaVersion": 1,
  "revision": "b365d5498cfb",
  "generatedAt": "2026-10-07T07:41:42.114Z",
  "source": {
    "folderId": "1KPtz1x1JqeLPxPLiqg-t93PWW4zBbhnq"
  },
  "settings": {
    "imageDurationSec": 60,
    "syncIntervalSec": 300,
    "order": "createdTime-asc"
  },
  "summary": {
    "totalAds": 14,
    "videos": 0,
    "images": 14,
    "totalBytes": 626907,
    "loopSec": 840,
    "unknownDurations": 0,
    "adFolders": [
      "anime",
      "cars",
      "nature"
    ]
  },
  "ads": [
    {
      "order": 1,
      "id": "1RtfFb833Y2JTNXc1CE22FW8u5aGA8u7j",
      "adName": "anime",
      "adFolderId": "13T8LiS9fIf5QOF-UI9tkZ4eGGThCudNd",
      "fileName": "a1.jpeg",
      "mimeType": "image/jpeg",
      "type": "image",
      "durationSec": 60,
      "sizeBytes": 49873,
      "md5": "6da2912a71b3c9e7ca0f81bed8e3fd28",
      "width": 738,
      "height": 414,
      "createdTime": "2026-10-06T11:40:51.558Z",
      "modifiedTime": "2026-10-06T11:32:08.849Z",
      "src": "https://www.googleapis.com/drive/v3/files/1RtfFb833Y2JTNXc1CE22FW8u5aGA8u7j?alt=media"
    },
    {
      "order": 2,
      "id": "1u-nnAKLobJkZZ0KyaRUX0k0smaoz02Ou",
      "adName": "anime",
      "adFolderId": "13T8LiS9fIf5QOF-UI9tkZ4eGGThCudNd",
      "fileName": "a2.jpeg",
      "mimeType": "image/jpeg",
      "type": "image",
      "durationSec": 60,
      "sizeBytes": 69801,
      "md5": "c441df77eae4f92ca015de3ea60712c7",
      "width": 738,
      "height": 414,
      "createdTime": "2026-10-06T11:40:51.577Z",
      "modifiedTime": "2026-10-06T11:32:24.055Z",
      "src": "https://www.googleapis.com/drive/v3/files/1u-nnAKLobJkZZ0KyaRUX0k0smaoz02Ou?alt=media"
    },
    {
      "order": 3,
      "id": "1gq4-oq2EXWLEPIxe8W6O4EwaXl0hDLYa",
      "adName": "anime",
      "adFolderId": "13T8LiS9fIf5QOF-UI9tkZ4eGGThCudNd",
      "fileName": "a5.jpeg",
      "mimeType": "image/jpeg",
      "type": "image",
      "durationSec": 60,
      "sizeBytes": 26092,
      "md5": "738e924085135f3e78f97adc8c43cdd5",
      "width": 738,
      "height": 414,
      "createdTime": "2026-10-06T11:40:51.688Z",
      "modifiedTime": "2026-10-06T11:34:01.668Z",
      "src": "https://www.googleapis.com/drive/v3/files/1gq4-oq2EXWLEPIxe8W6O4EwaXl0hDLYa?alt=media"
    },
    {
      "order": 4,
      "id": "1Zfo6uhnuf5x6YwhM5ffyjY0w_wOEPfJa",
      "adName": "anime",
      "adFolderId": "13T8LiS9fIf5QOF-UI9tkZ4eGGThCudNd",
      "fileName": "a4.jpeg",
      "mimeType": "image/jpeg",
      "type": "image",
      "durationSec": 60,
      "sizeBytes": 40697,
      "md5": "aff4e9237d7d4ba05bd03eab238a867f",
      "width": 700,
      "height": 438,
      "createdTime": "2026-10-06T11:40:51.693Z",
      "modifiedTime": "2026-10-06T11:33:48.537Z",
      "src": "https://www.googleapis.com/drive/v3/files/1Zfo6uhnuf5x6YwhM5ffyjY0w_wOEPfJa?alt=media"
    },
    {
      "order": 5,
      "id": "1avhJrQQSiYbN3328ZKzhQ7KuddxjW6AP",
      "adName": "anime",
      "adFolderId": "13T8LiS9fIf5QOF-UI9tkZ4eGGThCudNd",
      "fileName": "a3.jpeg",
      "mimeType": "image/jpeg",
      "type": "image",
      "durationSec": 60,
      "sizeBytes": 49391,
      "md5": "62c7f253fba79514dbfb6ac17d2ba12b",
      "width": 738,
      "height": 414,
      "createdTime": "2026-10-06T11:40:51.721Z",
      "modifiedTime": "2026-10-06T11:33:36.986Z",
      "src": "https://www.googleapis.com/drive/v3/files/1avhJrQQSiYbN3328ZKzhQ7KuddxjW6AP?alt=media"
    },
    {
      "order": 6,
      "id": "1oqTg72ih0DH7rK4WaY9Rpu6EQqluGSmu",
      "adName": "cars",
      "adFolderId": "1nJ7GpP0D-AeGP8g3eUS_iRr2CffTM9z8",
      "fileName": "c1.jpeg",
      "mimeType": "image/jpeg",
      "type": "image",
      "durationSec": 60,
      "sizeBytes": 41500,
      "md5": "197b9da278ae8433936e0844011773cb",
      "width": 515,
      "height": 388,
      "createdTime": "2026-10-06T11:41:19.114Z",
      "modifiedTime": "2026-10-06T11:30:09.146Z",
      "src": "https://www.googleapis.com/drive/v3/files/1oqTg72ih0DH7rK4WaY9Rpu6EQqluGSmu?alt=media"
    },
    {
      "order": 7,
      "id": "1EliSDbcS_9tZc5b-Rq4CLMnuu4-i1F0e",
      "adName": "cars",
      "adFolderId": "1nJ7GpP0D-AeGP8g3eUS_iRr2CffTM9z8",
      "fileName": "c2.jpeg",
      "mimeType": "image/jpeg",
      "type": "image",
      "durationSec": 60,
      "sizeBytes": 31092,
      "md5": "1d324888f3ffa99c3303b3d7c145adbf",
      "width": 738,
      "height": 414,
      "createdTime": "2026-10-06T11:41:19.170Z",
      "modifiedTime": "2026-10-06T11:30:16.131Z",
      "src": "https://www.googleapis.com/drive/v3/files/1EliSDbcS_9tZc5b-Rq4CLMnuu4-i1F0e?alt=media"
    },
    {
      "order": 8,
      "id": "1XyO-Zq1mULaLwClGezPmDb-ZFIRp3Bhu",
      "adName": "cars",
      "adFolderId": "1nJ7GpP0D-AeGP8g3eUS_iRr2CffTM9z8",
      "fileName": "c3.jpeg",
      "mimeType": "image/jpeg",
      "type": "image",
      "durationSec": 60,
      "sizeBytes": 44266,
      "md5": "643c29eeaa3257c795ece7f1be288dda",
      "width": 447,
      "height": 447,
      "createdTime": "2026-10-06T11:41:19.308Z",
      "modifiedTime": "2026-10-06T11:30:58.494Z",
      "src": "https://www.googleapis.com/drive/v3/files/1XyO-Zq1mULaLwClGezPmDb-ZFIRp3Bhu?alt=media"
    },
    {
      "order": 9,
      "id": "1O4DqdzufXBPmn36912r1WGgJ4Uh3Xbbf",
      "adName": "cars",
      "adFolderId": "1nJ7GpP0D-AeGP8g3eUS_iRr2CffTM9z8",
      "fileName": "c4.jpeg",
      "mimeType": "image/jpeg",
      "type": "image",
      "durationSec": 60,
      "sizeBytes": 46258,
      "md5": "96cbaedc38fcb902bb9410c26fb924b6",
      "width": 736,
      "height": 413,
      "createdTime": "2026-10-06T11:41:19.344Z",
      "modifiedTime": "2026-10-06T11:31:26.963Z",
      "src": "https://www.googleapis.com/drive/v3/files/1O4DqdzufXBPmn36912r1WGgJ4Uh3Xbbf?alt=media"
    },
    {
      "order": 10,
      "id": "15Q7TaakdyYHqGNeX1wrGr8fsUtAuTMlF",
      "adName": "nature",
      "adFolderId": "1qFIdNlc7whoOA1QuTfXqIG78L-8Dbfng",
      "fileName": "n4.jpeg",
      "mimeType": "image/jpeg",
      "type": "image",
      "durationSec": 60,
      "sizeBytes": 77705,
      "md5": "5e11c33f535ab1fee79d5ccad373258a",
      "width": 738,
      "height": 414,
      "createdTime": "2026-10-06T11:41:52.325Z",
      "modifiedTime": "2026-10-06T11:38:39.216Z",
      "src": "https://www.googleapis.com/drive/v3/files/15Q7TaakdyYHqGNeX1wrGr8fsUtAuTMlF?alt=media"
    },
    {
      "order": 11,
      "id": "1cVptq-nTn42kiW5DRw6qE4ZBziUgr3Hc",
      "adName": "nature",
      "adFolderId": "1qFIdNlc7whoOA1QuTfXqIG78L-8Dbfng",
      "fileName": "n2.jpeg",
      "mimeType": "image/jpeg",
      "type": "image",
      "durationSec": 60,
      "sizeBytes": 50249,
      "md5": "69189105d1626ad2da5ea8c48451110e",
      "width": 547,
      "height": 365,
      "createdTime": "2026-10-06T11:41:52.438Z",
      "modifiedTime": "2026-10-06T11:38:10.284Z",
      "src": "https://www.googleapis.com/drive/v3/files/1cVptq-nTn42kiW5DRw6qE4ZBziUgr3Hc?alt=media"
    },
    {
      "order": 12,
      "id": "1BS-InDiT8Wbz5MYsuL-h-ENOgNqkgETR",
      "adName": "nature",
      "adFolderId": "1qFIdNlc7whoOA1QuTfXqIG78L-8Dbfng",
      "fileName": "n3.jpeg",
      "mimeType": "image/jpeg",
      "type": "image",
      "durationSec": 60,
      "sizeBytes": 38982,
      "md5": "a0d04c160030ceec1a2eac849c358230",
      "width": 678,
      "height": 452,
      "createdTime": "2026-10-06T11:41:52.455Z",
      "modifiedTime": "2026-10-06T11:38:24.742Z",
      "src": "https://www.googleapis.com/drive/v3/files/1BS-InDiT8Wbz5MYsuL-h-ENOgNqkgETR?alt=media"
    },
    {
      "order": 13,
      "id": "1-bKux6KHrYwSmYGi0W7nKz_KOaDvl8Xv",
      "adName": "nature",
      "adFolderId": "1qFIdNlc7whoOA1QuTfXqIG78L-8Dbfng",
      "fileName": "n1.jpeg",
      "mimeType": "image/jpeg",
      "type": "image",
      "durationSec": 60,
      "sizeBytes": 42557,
      "md5": "bf7386ea284a1f3d8e372122647a6cb3",
      "width": 547,
      "height": 365,
      "createdTime": "2026-10-06T11:41:52.472Z",
      "modifiedTime": "2026-10-06T11:38:02.839Z",
      "src": "https://www.googleapis.com/drive/v3/files/1-bKux6KHrYwSmYGi0W7nKz_KOaDvl8Xv?alt=media"
    },
    {
      "order": 14,
      "id": "15gTperaaRsHb0fk-Iv8tcvaSIX_hRxtw",
      "adName": "cars",
      "adFolderId": "1nJ7GpP0D-AeGP8g3eUS_iRr2CffTM9z8",
      "fileName": "c5.jpeg",
      "mimeType": "image/jpeg",
      "type": "image",
      "durationSec": 60,
      "sizeBytes": 18444,
      "md5": "8e53af9c2fabc78f8339b9ec0ed8c325",
      "width": 554,
      "height": 554,
      "createdTime": "2026-10-06T11:42:11.910Z",
      "modifiedTime": "2026-10-06T11:29:57.984Z",
      "src": "https://www.googleapis.com/drive/v3/files/15gTperaaRsHb0fk-Iv8tcvaSIX_hRxtw?alt=media"
    }
  ],
  "skipped": []
}
